<?xml version="1.0" encoding="UTF-8"?>
<addresses xmlns:xsi="http://www.w3.org/2001/XMLSchema-instance" xsi:schemaLocation="file:///C:/Users\rogalmic\Documents\src\vscode-xml-complete\test\Simple\Simple.xsd">
<!-- notice the autocompletion descriptions from xsd documentation nodes -->
  <address>
    <name>Joe Tester</name>
    <street>Baker street 5</street>
    <wrongExtraField/>
  </address>
  <address>
    <name >Bill Kill</name>
    <street>By Drive 5</street>
  </address>
</addresses>